question,course,document
What should I do if I've spun up a VM in GCP?,data-engineering-zoomcamp,206
Why can't I read and write data in different locations on GCP BQ?,data-engineering-zoomcamp,207
How to load data from GCS into BigQuery if they're in different regions?,data-engineering-zoomcamp,207
What should I do if my GCS Bucket and BigQuery dataset are in different regions?,data-engineering-zoomcamp,207
How can I ensure my GCS Bucket and BigQuery dataset are in the same region?,data-engineering-zoomcamp,207
What happens if I try to load data from GCS to BigQuery with different regions?,data-engineering-zoomcamp,207
Why can't I read and write data in different regions in GCP BQ?,data-engineering-zoomcamp,208
How do I ensure my BigQuery dataset and GCS Bucket are in the same location?,data-engineering-zoomcamp,208
What happens if my BigQuery dataset and GCS Bucket are in different regions?,data-engineering-zoomcamp,208
How can I fix the issue of not being able to read and write data in different regions in GCP BQ?,data-engineering-zoomcamp,208
What is the correct way to create a BigQuery dataset and GCS Bucket in the same region?,data-engineering-zoomcamp,208
How do I save my SQL queries in BigQuery?,data-engineering-zoomcamp,209
What happens if I don't save my queries?,data-engineering-zoomcamp,209
Can I save my queries to a file outside of BigQuery?,data-engineering-zoomcamp,209
What file format should I use to save my queries?,data-engineering-zoomcamp,209
How do I access my saved queries in BigQuery?,data-engineering-zoomcamp,209
Can I use BigQuery for real-time analytics in this project?,data-engineering-zoomcamp,210
How does BigQuery handle real-time data?,data-engineering-zoomcamp,210
Is BigQuery suitable for immediate data analysis?,data-engineering-zoomcamp,210
Can I stream data into BigQuery in real-time?,data-engineering-zoomcamp,210
What are the real-time data capabilities of BigQuery?,data-engineering-zoomcamp,210
How can I resolve the 'invalid timestamp' error when loading data from external tables in BigQuery?,data-engineering-zoomcamp,211
Why am I encountering issues with the 'pickup_datetime' field while appending data to a file in Google Cloud Storage?,data-engineering-zoomcamp,211
How can I identify problematic data in the timestamp column?,data-engineering-zoomcamp,211
What is the benefit of defining the schema from the external table using string datatype?,data-engineering-zoomcamp,211
How can I filter out invalid rows and insert fields with the timestamp data type?,data-engineering-zoomcamp,211
"What does the error 'annotated as a valid Timestamp, please annotate it as TimestampType(MICROS) or TimestampType(MILLIS)' mean in BigQuery?",data-engineering-zoomcamp,212
What are the compatible timestamp formats between PyArrow and PySpark for Parquet files?,data-engineering-zoomcamp,212
How can I edit Parquet files with Python without causing datetime format errors?,data-engineering-zoomcamp,212
What is the issue when converting Parquet timestamp to BigQuery and it comes across as an integer?,data-engineering-zoomcamp,212
How do I write timestamps to INT96 Parquet format in BigQuery?,data-engineering-zoomcamp,212
How can I ensure datetime columns in Parquet files created from Pandas are recognized as timestamp in BigQuery?,data-engineering-zoomcamp,213
What's the correct way to use PyArrow to generate Parquet files with the right logical type for datetime columns?,data-engineering-zoomcamp,213
How can I provide an explicit schema to PyArrow for generating Parquet files with correct datetime types?,data-engineering-zoomcamp,213
Why aren't my datetime columns converting to timestamp when loaded into BigQuery?,data-engineering-zoomcamp,213
How can I convert integer columns in Epoch milliseconds to Timestamp columns in microseconds ('us') using PyArrow?,data-engineering-zoomcamp,213
How do I create an external table in BigQuery using Python?,data-engineering-zoomcamp,214
What is the format of the external data in the provided solution?,data-engineering-zoomcamp,214
How do I set the source URIs for my external table?,data-engineering-zoomcamp,214
What is the purpose of the `external_config.autodetect` parameter?,data-engineering-zoomcamp,214
How do I create a BigQuery client object in Python?,data-engineering-zoomcamp,214
How do I check if a BigQuery table already exists using the table ID in Python?,data-engineering-zoomcamp,215
What is the function to get a table using its ID in BigQuery's Python client library?,data-engineering-zoomcamp,215
How can I handle exceptions when trying to retrieve a non-existent table in BigQuery?,data-engineering-zoomcamp,215
What is the purpose of the `client.get_table(tableID)` function in BigQuery's Python client library?,data-engineering-zoomcamp,215
How can I combine the 'Create External Table using Python' function with the 'client.create_table' function in BigQuery?,data-engineering-zoomcamp,215
Why can't I read and write data in different locations in GCP BQ?,data-engineering-zoomcamp,217
How do I resolve the issue of GCP BQ not allowing read and write in different locations?,data-engineering-zoomcamp,217
What's causing the problem when I try to use GCP BQ with different regions for GCS and BigQuery storage?,data-engineering-zoomcamp,217
How can I ensure my GCS and BigQuery storage are in the same region to avoid read/write issues in GCP BQ?,data-engineering-zoomcamp,217
What steps should I follow to make GCP BQ work with the same region for GCS and BigQuery storage?,data-engineering-zoomcamp,217
How do I use Cloud Functions to automate loading CSV.gz files from GitHub to BigQuery in GCP?,data-engineering-zoomcamp,218
What is the Python script for loading files directly to BigQuery using Cloud Functions?,data-engineering-zoomcamp,218
How can I define the schema for the data in the CSV.gz files?,data-engineering-zoomcamp,218
What is the purpose of using a temporary file in this process?,data-engineering-zoomcamp,218
How can I ensure that the data is loaded into the correct table in BigQuery?,data-engineering-zoomcamp,218
Why do I get the same result when using count(distinct(*)) on both external and materialized tables in GCP BQ?,data-engineering-zoomcamp,219
How can I ensure I get different results when querying external and materialized tables in GCP BQ using count(distinct(*))?,data-engineering-zoomcamp,219
What setting should I adjust to get different results when querying external and materialized tables in GCP BQ using count(distinct(*))?,data-engineering-zoomcamp,219
How does caching affect the results of count(distinct(*)) on external and materialized tables in GCP BQ?,data-engineering-zoomcamp,219
What should I do to avoid caching when querying external and materialized tables in GCP BQ using count(distinct(*))?,data-engineering-zoomcamp,219
How do I handle type errors when moving data from BigQuery to Parquet in GCS?,data-engineering-zoomcamp,220
Why is there a mismatch between the data type in Parquet and BigQuery for columns like DOlocationID and PUlocationID?,data-engineering-zoomcamp,220
How can I ensure consistent data types between Parquet and BigQuery when using Pandas for data injection?,data-engineering-zoomcamp,220
What's the best way to define data types in the Transformation section of an ETL pipeline?,data-engineering-zoomcamp,220
How can I handle missing values in columns like DOlocationID and PUlocationID when using Pandas?,data-engineering-zoomcamp,220
What's causing the error when reading table 'trips_data_all.external_fhv_tripdata' in BigQuery?,data-engineering-zoomcamp,221
How can I resolve the issue with the 'DOlocationID' column having type INT64 instead of DOUBLE?,data-engineering-zoomcamp,221
Why am I encountering an error with an invalid project ID in GCP BQ?,data-engineering-zoomcamp,221
What are the valid characters for a project ID in GCP BQ?,data-engineering-zoomcamp,221
How can I fix the issue with misplaced content after the 'from' clause in BigQuery SQLs?,data-engineering-zoomcamp,221
Does BigQuery support partitioning by multiple columns?,data-engineering-zoomcamp,222
Can I partition a table in BigQuery using more than one column?,data-engineering-zoomcamp,222
Is it possible to partition a BigQuery table by multiple columns at once?,data-engineering-zoomcamp,222
Can I use more than one column for partitioning in BigQuery?,data-engineering-zoomcamp,222
Does BigQuery support multi-column partitioning?,data-engineering-zoomcamp,222
What does the error 'Parquet column 'DOlocationID' has type INT64 which does not match the target cpp_type DOUBLE' mean?,data-engineering-zoomcamp,223
"How can I fix the error 'PARTITION BY expression must be DATE(<timestamp_column>), DATE(<datetime_column>), ...' in BigQuery?",data-engineering-zoomcamp,223
Why am I encountering an error while reading the table 'trips_data_all.external_fhv_tripdata'?,data-engineering-zoomcamp,223
How do I convert a column to datetime in pandas?,data-engineering-zoomcamp,223
What is the issue with the 'pickup_datetime' and 'dropOff_datetime' columns in my DataFrame?,data-engineering-zoomcamp,223
What's the difference between Native tables and External tables in BigQuery?,data-engineering-zoomcamp,224
Why am I getting an error about data type mismatch for column 'DOlocationID' in table 'trips_data_all.external_fhv_tripdata'?,data-engineering-zoomcamp,224
How can I resolve the error message 'Parquet column 'DOlocationID' has type INT64 which does not match the target cpp_type DOUBLE'?,data-engineering-zoomcamp,224
What are the resources to learn more about Native and External tables in BigQuery?,data-engineering-zoomcamp,224
How does BigQuery handle data types when reading external tables?,data-engineering-zoomcamp,224
Why am I getting an error when trying to read the 'trips_data_all.external_fhv_tripdata' table in BigQuery?,data-engineering-zoomcamp,225
What's causing the 'Parquet column 'DOlocationID' has type INT64 which does not match the target cpp_type DOUBLE' error?,data-engineering-zoomcamp,225
How do I fix the 'BigQuery error in extract operation: Error processing job Not found: Dataset was not found in location US' error when trying to export an ML model from BQ to GCS?,data-engineering-zoomcamp,225
Why is my command failing with the error 'Dataset was not found in location US' when the BQ dataset and GCS bucket are in the same region (us-west1)?,data-engineering-zoomcamp,225
How do I correctly specify the project_id and gcs_bucket folder address in the bq extract command?,data-engineering-zoomcamp,225
Why is there an error when reading the 'trips_data_all.external_fhv_tripdata' table due to a mismatch in data types for the 'DOlocationID' column?,data-engineering-zoomcamp,226
How can I resolve the error that occurs when running 'fact_trips.sql' due to the absence of the 'Dim_zones.sql' dataset in the US location?,data-engineering-zoomcamp,226
What should I update in the 'Dim_zones.sql' creation to ensure it's located in the US?,data-engineering-zoomcamp,226
How do I run the 'Dim_zones' table again after making the necessary updates?,data-engineering-zoomcamp,226
What should I do after running 'Dim_zones' to resolve the issue with 'fact_trips'?,data-engineering-zoomcamp,226
Why is there an error when reading the 'trips_data_all.external_fhv_tripdata' table in BigQuery ML?,data-engineering-zoomcamp,227
How can I resolve the issue with 'Parquet column 'DOlocationID' has type INT64 which does not match the target cpp_type DOUBLE'?,data-engineering-zoomcamp,227
Why doesn't the GCP BQ ML - Export ML model to make predictions work on a MacBook with Apple M1 chip (arm architecture)?,data-engineering-zoomcamp,227
How can I set up serving_dir on my MacBook to make predictions using the GCP BQ ML model?,data-engineering-zoomcamp,227
What are the specific Docker commands to use for running the model on my MacBook with Apple M1 chip?,data-engineering-zoomcamp,227
What should I do if a column in my table has a data type that doesn't match the target type?,data-engineering-zoomcamp,228
How can I free up space on my VM when it's running out of space?,data-engineering-zoomcamp,228
What steps can I take to delete data saved locally during ETLs on my VM?,data-engineering-zoomcamp,228
How can I identify large files on my VM to free up space?,data-engineering-zoomcamp,228
What changes should I make to my flow code if I delete files related to Prefect?,data-engineering-zoomcamp,228
What does 'Stop with loading the files into a bucket' mean?,data-engineering-zoomcamp,229
Why is there an error with the 'DOlocationID' column in the 'trips_data_all.external_fhv_tripdata' table?,data-engineering-zoomcamp,229
How can I resolve the 'Parquet column 'DOlocationID' has type INT64 which does not match the target cpp_type DOUBLE' error?,data-engineering-zoomcamp,229
What should I do after loading the files into the bucket?,data-engineering-zoomcamp,229
What is the next step after creating an external table based on the files in the bucket?,data-engineering-zoomcamp,229
Why am I getting an 'Out of bounds' error when reading parquet files from nyc.gov into pandas?,data-engineering-zoomcamp,230
What causes the error 'Casting from timestamp[us] to timestamp[ns] would result in out of bounds' in pandas?,data-engineering-zoomcamp,230
How can I fix the error when reading parquet files from nyc.gov into pandas that involves an 'errant data record' with an incorrect year?,data-engineering-zoomcamp,230
What is the recommended way to read datetime columns from parquet files using pyarrow to avoid timestamp errors?,data-engineering-zoomcamp,230
How can I remove rows with out-of-bounds timestamps from a parquet file using pyarrow's compute.filter function?,data-engineering-zoomcamp,230
How many parquet files do I need for green taxi 2022 for homework 3?,data-engineering-zoomcamp,231
Are the 2022 NYC taxi data parquet files available as a single file or separate?,data-engineering-zoomcamp,231
Do I need to add all 12 files to my GCS bucket for the 2022 green taxi data?,data-engineering-zoomcamp,231
Can I use a wildcard to refer to all 12 files when creating an external table in BigQuery?,data-engineering-zoomcamp,231
What is the correct data type for 'DOlocationID' in the 'trips_data_all.external_fhv_tripdata' table?,data-engineering-zoomcamp,231
How do I avoid schema issues in the homework?,data-engineering-zoomcamp,232
Can I upload multiple files at once to GCS via GUI?,data-engineering-zoomcamp,232
Is there a way to upload a folder to GCS using the GUI?,data-engineering-zoomcamp,232
What is the recommended method to upload files to GCS for the homework?,data-engineering-zoomcamp,232
How can I ensure the correct schema when uploading files to GCS?,data-engineering-zoomcamp,232
Why is there an error when reading the 'trips_data_all.external_fhv_tripdata' table?,data-engineering-zoomcamp,233
What does the error message 'Parquet column 'DOlocationID' has type INT64 which does not match the target cpp_type DOUBLE' mean?,data-engineering-zoomcamp,233
How can I fix the issue with the partitioned/clustered table not giving the expected prediction?,data-engineering-zoomcamp,233
What should I check regarding the format of the dates in the question?,data-engineering-zoomcamp,233
How can I ensure the data types in my Parquet columns match the target types?,data-engineering-zoomcamp,233
Why am I getting an error when reading the 'trips_data_all.external_fhv_tripdata' table with the message 'Parquet column 'DOlocationID' has type INT64 which does not match the target cpp_type DOUBLE'?,data-engineering-zoomcamp,234
Is it normal that many people aren't getting an exact match for one of the options in Module 3 homework Q6?,data-engineering-zoomcamp,234
How should I proceed if my answer to Module 3 homework Q6 is very close to one of the given options but not an exact match?,data-engineering-zoomcamp,234
What could be causing the mismatch in data types between the 'DOlocationID' column in the 'trips_data_all.external_fhv_tripdata' table and the target cpp_type DOUBLE?,data-engineering-zoomcamp,234
What does Alexey suggest I do if my answer to Module 3 homework Q6 is not an exact match to any of the given options?,data-engineering-zoomcamp,234
What's the error when reading table 'trips_data_all.external_fhv_tripdata'?,data-engineering-zoomcamp,235
How to handle 'UnicodeDecodeError: 'utf-8' codec can't decode byte 0xa0'?,data-engineering-zoomcamp,235
What's the correct encoding for reading data into pandas dataframe?,data-engineering-zoomcamp,235
How to write a dataframe to GCS as a csv with correct encoding?,data-engineering-zoomcamp,235
What's an alternative to reading csv data?,data-engineering-zoomcamp,235
What is the error message for the 'trips_data_all.external_fhv_tripdata' table?,data-engineering-zoomcamp,236
Why does the 'DOlocationID' column have type INT64 instead of the target type DOUBLE?,data-engineering-zoomcamp,236
How can I fix the error where the Parquet column 'DOlocationID' has type INT64?,data-engineering-zoomcamp,236
What is a generator in Python?,data-engineering-zoomcamp,236
How does a generator differ from a list or a tuple in Python?,data-engineering-zoomcamp,236
How can I read multiple Parquet files at once in Python?,data-engineering-zoomcamp,237
What if I have a column with INT64 type but the target is DOUBLE?,data-engineering-zoomcamp,237
How to handle type mismatch in Parquet columns?,data-engineering-zoomcamp,237
Is there a way to merge multiple Parquet files into one table?,data-engineering-zoomcamp,237
How can I read and merge Parquet files efficiently?,data-engineering-zoomcamp,237
Why is my code not working for the 'DOlocationID' column in Python?,data-engineering-zoomcamp,238
How do I correctly convert the 'DOlocationID' column to Int64 in Python?,data-engineering-zoomcamp,238
What's the issue with using 'pd.to_numeric' or '.astype(int)' for 'DOlocationID' column?,data-engineering-zoomcamp,238
How can I ensure the 'DOlocationID' column is of type Int64 in Python?,data-engineering-zoomcamp,238
What's the correct way to handle the 'DOlocationID' column type in Python?,data-engineering-zoomcamp,238
What is the error message when trying to read the 'trips_data_all.external_fhv_tripdata' table in Prefect?,data-engineering-zoomcamp,239
Why is the 'cache_key_fn=task_input_hash' causing an error in my Prefect flow?,data-engineering-zoomcamp,239
How can I resolve the 'ValueError: Path does not exist' error in Prefect?,data-engineering-zoomcamp,239
What is the purpose of using a 'cache_key' in Prefect flows?,data-engineering-zoomcamp,239
How can I prevent Prefect from repeating previously completed processes?,data-engineering-zoomcamp,239
How do I download a .csv.gz file from a URL using Prefect?,data-engineering-zoomcamp,240
What is the purpose of the 'download_file' function in this context?,data-engineering-zoomcamp,240
How does the 'extract_from_web' flow use the 'download_file' task?,data-engineering-zoomcamp,240
What is the role of the 'requests' library in this process?,data-engineering-zoomcamp,240
How can I specify the file path and URL in the 'extract_from_web' flow?,data-engineering-zoomcamp,240
What should I do if I'm getting a 'not found in location us' error in DBT Cloud production?,data-engineering-zoomcamp,241
How can I update seed column types in the dbt_project.yaml file for using double and int?,data-engineering-zoomcamp,241
Why is a prod dataset being created in BigQuery with a location US when I've specified EU?,data-engineering-zoomcamp,241
How do I fix the 'ERROR 404: project.dataset:prod not available in location EU' issue in DBT Cloud production?,data-engineering-zoomcamp,241
What's the simple solution to run my DBT models in production with a dataset location of EU?,data-engineering-zoomcamp,241
How do I fix the 'No development environment' error in dbt?,data-engineering-zoomcamp,242
What does 'configure your development credentials' mean in this context?,data-engineering-zoomcamp,242
Where can I find a guide to set up a development environment in dbt?,data-engineering-zoomcamp,242
At what timestamp in the videos is the solution to this issue discussed?,data-engineering-zoomcamp,242
Is there a specific channel on Slack where I can ask for help with this issue?,data-engineering-zoomcamp,242
Why is dbt unable to connect to BigQuery?,data-engineering-zoomcamp,243
What permissions are required for dbt to create jobs in BigQuery?,data-engineering-zoomcamp,243
How can I grant BigQuery Job User role to my dbt service account?,data-engineering-zoomcamp,243
What other roles should I add to prevent future permission issues?,data-engineering-zoomcamp,243
How do I test my connection after updating permissions?,data-engineering-zoomcamp,243
Why is my dbt Cloud run being cancelled?,data-engineering-zoomcamp,244
What's causing the 'valid dbt project not found' error?,data-engineering-zoomcamp,244
How do I ensure my dbt project is properly configured?,data-engineering-zoomcamp,244
Where should I place my dbt_project.yml file?,data-engineering-zoomcamp,244
How can I specify the location of my dbt project in dbt Cloud?,data-engineering-zoomcamp,244
Why did the git clone fail?,data-engineering-zoomcamp,245
How can I fix the 'Permission denied (publickey)' error?,data-engineering-zoomcamp,245
What are the alternative solutions to clone the repository?,data-engineering-zoomcamp,245
Why is it recommended to use a forked repo with my username?,data-engineering-zoomcamp,245
What are the benefits of creating a fresh repo for dbt-lessons?,data-engineering-zoomcamp,245
Why can't I create a new Continuous Integration job in dbt cloud when triggered by pull requests?,data-engineering-zoomcamp,246
What plans allow me to set up a CI Job in dbt Cloud?,data-engineering-zoomcamp,246
"I'm on the Team Plan, why is the CI Job option still disabled?",data-engineering-zoomcamp,246
Can I use CI Jobs on the Developer Plan?,data-engineering-zoomcamp,246
What's an alternative to CI Jobs for the Developer Plan?,data-engineering-zoomcamp,246
Why is my DBT cloud IDE not starting?,data-engineering-zoomcamp,247
How do I resolve the 'Unable to start IDE session' error?,data-engineering-zoomcamp,247
What should I do if DBT cloud IDE is loading indefinitely?,data-engineering-zoomcamp,247
How can I set up my IDE session for DBT cloud?,data-engineering-zoomcamp,247
Where can I find the solution to the 'Unable to start IDE session' error?,data-engineering-zoomcamp,247
How do I handle different data types in columns when converting CSV to Parquet using Python?,data-engineering-zoomcamp,248
Why am I encountering an error about column data types when running dbt with BigQuery?,data-engineering-zoomcamp,248
How can I define the schema while running the web_to_gcs.py pipeline in DBT?,data-engineering-zoomcamp,248
What's causing the 'Parquet column has type DOUBLE which does not match the target cpp_type INT64' error in dbt?,data-engineering-zoomcamp,248
How can I specify data types when importing a file from CSV to a DataFrame using pandas?,data-engineering-zoomcamp,248
How can I access the trip data if the provided S3 URL isn't working?,data-engineering-zoomcamp,249
What's the GitHub CLI and how do I download it?,data-engineering-zoomcamp,249
How do I authenticate the GitHub CLI?,data-engineering-zoomcamp,249
How can I list the releases in the nyc-tlc-data repository?,data-engineering-zoomcamp,249
How do I download specific releases (like 'yellow' or 'green') using the GitHub CLI?,data-engineering-zoomcamp,249
Why am I getting a pyarrow.lib.ArrowInvalid error when converting fhv_tripdata_2020-01.csv using Airflow?,data-engineering-zoomcamp,250
"What's causing the 'Expected 7 columns, got 1' error in my CSV file?",data-engineering-zoomcamp,250
How can I fix the line breaks in fhv_tripdata_2020-01.csv to resolve the error?,data-engineering-zoomcamp,250
What command should I run in the Airflow container to delete random line breaks in the CSV file?,data-engineering-zoomcamp,250
"After fixing the file, how do I force Airflow to re-execute the failed task?",data-engineering-zoomcamp,250
How can I efficiently load yellow and green trip data for 2019 and 2020?,data-engineering-zoomcamp,251
What's a faster method to load yellow trip data compared to the initial approach?,data-engineering-zoomcamp,251
Why did I encounter schema inconsistency when uploading parquet files directly to BigQuery?,data-engineering-zoomcamp,251
Is there a specific hack suggested by Victoria for loading data to BigQuery in Week 4?,data-engineering-zoomcamp,251
What are the required schema changes mentioned in the YouTube video for Week 4?,data-engineering-zoomcamp,251
How do I transfer multiple files from a Google Cloud Storage bucket to BigQuery?,data-engineering-zoomcamp,252
What's the syntax to move many files at once?,data-engineering-zoomcamp,252
How can I specify the destination folder for these files?,data-engineering-zoomcamp,252
What should I include in the destination folder to move all files?,data-engineering-zoomcamp,252
"How do I ensure all files are moved, not just one?",data-engineering-zoomcamp,252
Why did SSH stop working for my GCP VM after the last restart?,data-engineering-zoomcamp,253
What could be causing SSH to suddenly stop working on my VM?,data-engineering-zoomcamp,253
How can I fix SSH connectivity issues on my GCP VM after a restart?,data-engineering-zoomcamp,253
What should I check if SSH stops working on my GCP VM?,data-engineering-zoomcamp,253
How can I prevent SSH from stopping working on my GCP VM after a restart?,data-engineering-zoomcamp,253
How can I regain SSH access to my GCP VM when I've run out of disk space?,data-engineering-zoomcamp,254
