question,course,document
How do I remotely connect to my WSL instance using VS Code?,machine-learning-zoomcamp,461
How do I push my first commit to GitHub?,machine-learning-zoomcamp,462
What should I do if I get an error pushing to the 'master' branch?,machine-learning-zoomcamp,462
Is there a tutorial for GitHub beginners?,machine-learning-zoomcamp,462
Can I use Google Colab to directly share my code on GitHub?,machine-learning-zoomcamp,462
What if I don't want to use the command line to upload my homework?,machine-learning-zoomcamp,462
Why can't I invert my matrix?,machine-learning-zoomcamp,463
What causes a singular matrix error?,machine-learning-zoomcamp,463
How does matrix multiplication affect invertibility?,machine-learning-zoomcamp,463
Why is the order of multiplication important for matrix inversion?,machine-learning-zoomcamp,463
What happens if I don't respect the order of matrix multiplication?,machine-learning-zoomcamp,463
Why doesn't the command 'conda create -n ml-zoomcamp python=3.9' work?,machine-learning-zoomcamp,464
How can I use Conda on Windows?,machine-learning-zoomcamp,464
What should I do if I don't have Anaconda or Miniconda installed?,machine-learning-zoomcamp,464
"Why aren't the Python versions 3.8, 3.9, and 3.10 working with Conda?",machine-learning-zoomcamp,464
What is the Anaconda Prompt and how do I use it?,machine-learning-zoomcamp,464
How do I read a dataset with Pandas in Windows?,machine-learning-zoomcamp,465
Why doesn't my current code work for reading a CSV file in Windows?,machine-learning-zoomcamp,465
How can I fix the issue with backslashes in file paths for Python in Windows?,machine-learning-zoomcamp,465
What is the correct way to load a CSV file using Pandas in Windows?,machine-learning-zoomcamp,465
How does adding 'r' before the file path in Python help with file navigation in Windows?,machine-learning-zoomcamp,465
What does the '403 Forbidden' error mean when pushing to GitHub?,machine-learning-zoomcamp,466
How can I fix the '403 Forbidden' error when pushing to a GitHub repository?,machine-learning-zoomcamp,466
What command should I use to check the current URL for my Git repository?,machine-learning-zoomcamp,466
How do I change the URL for my Git repository to include my GitHub username and password?,machine-learning-zoomcamp,466
What command should I use to reflect the URL change for my Git repository?,machine-learning-zoomcamp,466
Why am I getting 'Authentication failed' error when pushing to GitHub from Git Bash?,machine-learning-zoomcamp,467
How can I resolve the 'Support for password authentication was removed' issue on GitHub?,machine-learning-zoomcamp,467
"What are the recommended modes of authentication for GitHub after August 13, 2021?",machine-learning-zoomcamp,467
How do I create a personal access token on my GitHub account?,machine-learning-zoomcamp,467
How can I use a personal access token to push changes to my GitHub repository?,machine-learning-zoomcamp,467
How do I resolve the 'unable to resolve host address' error when using wget in Kaggle?,machine-learning-zoomcamp,468
Why am I encountering issues with wget not resolving host addresses in Kaggle?,machine-learning-zoomcamp,468
How can I fix the 'failed: Temporary failure in name resolution' error with wget in Kaggle?,machine-learning-zoomcamp,468
What settings in Kaggle need to be changed to resolve wget host resolution issues?,machine-learning-zoomcamp,468
How do I enable internet access for my Kaggle session to resolve wget host address errors?,machine-learning-zoomcamp,468
How do I set up a Python environment using VS Code?,machine-learning-zoomcamp,469
Can I use Jupyter Notebooks directly in VS Code?,machine-learning-zoomcamp,469
How can I work with GitHub from VS Code?,machine-learning-zoomcamp,469
Is there a way to execute remote Jupyter Notebooks on a server from my local VS Code?,machine-learning-zoomcamp,469
How do I stage and commit changes in Git using VS Code's UI?,machine-learning-zoomcamp,469
Do we need to run 'conda create -n ...' every time we open VS Code to work on the project?,machine-learning-zoomcamp,470
"Once the environment is created, do we still need to run 'conda create -n ...'?",machine-learning-zoomcamp,470
What command do we use to activate the environment once it's created?,machine-learning-zoomcamp,470
How can we save our existing environment for future use?,machine-learning-zoomcamp,470
Can we recreate the environment using a YAML file?,machine-learning-zoomcamp,470
Why doesn't multiplying an inverted matrix with its original matrix result in an identity matrix?,machine-learning-zoomcamp,471
What causes the slight discrepancy in the output matrix?,machine-learning-zoomcamp,471
How does floating point math affect matrix multiplication?,machine-learning-zoomcamp,471
Why doesn't the inverse of a matrix always perfectly revert it to the original matrix?,machine-learning-zoomcamp,471
What can be done to mitigate the effects of floating point precision in matrix operations?,machine-learning-zoomcamp,471
What does pandas.DataFrame.info() do?,machine-learning-zoomcamp,472
How can I get information about my dataset in pandas?,machine-learning-zoomcamp,472
What kind of information does df.info() provide?,machine-learning-zoomcamp,472
What is the memory usage of a dataset in pandas?,machine-learning-zoomcamp,472
How can I check the datatype of columns in a pandas DataFrame?,machine-learning-zoomcamp,472
Why am I getting a NameError for 'np'?,machine-learning-zoomcamp,473
How do I fix the 'np' is not defined error?,machine-learning-zoomcamp,473
What should I import before using numpy or pandas?,machine-learning-zoomcamp,473
Why is 'pd' not defined?,machine-learning-zoomcamp,473
How can I ensure pandas and numpy are imported correctly?,machine-learning-zoomcamp,473
How to select columns by data type in a DataFrame with many columns?,machine-learning-zoomcamp,474
How to get only numeric columns in a concise way?,machine-learning-zoomcamp,474
How to get only object columns in a concise way?,machine-learning-zoomcamp,474
What if there are hundreds of columns to filter by data type?,machine-learning-zoomcamp,474
How to efficiently select columns based on their data type?,machine-learning-zoomcamp,474
How do I determine the shape of a dataset in Pandas?,machine-learning-zoomcamp,475
What attribute can I use to identify the shape of a dataset in Pandas?,machine-learning-zoomcamp,475
How can I find the number of rows in a Pandas dataset?,machine-learning-zoomcamp,475
What command can I use to find the number of columns in a Pandas dataset?,machine-learning-zoomcamp,475
Is there a simple way to check the dimensions of a Pandas DataFrame?,machine-learning-zoomcamp,475
How can I avoid Value errors when dealing with array shapes in my homework?,machine-learning-zoomcamp,476
What's the correct way to perform matrix multiplication in Python?,machine-learning-zoomcamp,476
Why is the order of matrix multiplication important?,machine-learning-zoomcamp,476
How can I ensure the number of columns in the first matrix matches the number of rows in the second matrix for multiplication?,machine-learning-zoomcamp,476
What should I do if the number of columns in the first matrix doesn't match the number of rows in the second matrix?,machine-learning-zoomcamp,476
Why do we replace NaN values with the average of the column?,machine-learning-zoomcamp,477
How do we calculate the average to replace NaN values?,machine-learning-zoomcamp,477
What is the process to replace NaN values with the average of the column?,machine-learning-zoomcamp,477
Why not remove rows with NaN values?,machine-learning-zoomcamp,477
What is the method called when we replace NaN values with the average of the column?,machine-learning-zoomcamp,477
What is the mathematical formula for linear regression?,machine-learning-zoomcamp,478
How can I calculate the initial problem in linear regression?,machine-learning-zoomcamp,478
"What is the relationship between the matrix X, weights w, and target y in linear regression?",machine-learning-zoomcamp,478
Can you explain the Ordinary Least Squares method in linear regression?,machine-learning-zoomcamp,478
How does the Pseudoinverse Solution apply to Ordinary Least Squares in linear regression?,machine-learning-zoomcamp,478
Why is my final multiplication result not showing 5 columns?,machine-learning-zoomcamp,479
What might be causing my multiplication result to not have 5 columns?,machine-learning-zoomcamp,479
How can I fix my multiplication result to show 5 columns?,machine-learning-zoomcamp,479
What did I do wrong in my multiplication that resulted in less than 5 columns?,machine-learning-zoomcamp,479
What is the correct order of steps for the multiplication to result in 5 columns?,machine-learning-zoomcamp,479
What operator is used for matrix-matrix multiplication in numpy?,machine-learning-zoomcamp,480
How does numpy handle element-wise multiplication?,machine-learning-zoomcamp,480
What function should I use for matrix-matrix multiplication in numpy?,machine-learning-zoomcamp,480
What is the preferred method for multiplying matrices in numpy?,machine-learning-zoomcamp,480
How does numpy handle scalar multiplication with matrices?,machine-learning-zoomcamp,480
What should I do if I encounter an ImportError when launching a Jupyter notebook in a new environment?,machine-learning-zoomcamp,481
How can I resolve the 'cannot import name 'contextfilter' from 'jinja2' error in Anaconda?,machine-learning-zoomcamp,481
What command should I run to upgrade nbconvert in my environment?,machine-learning-zoomcamp,481
Why am I facing issues launching a new Jupyter notebook in a brand new environment?,machine-learning-zoomcamp,481
How can I switch to the main environment to resolve this issue?,machine-learning-zoomcamp,481
Why does wget https://raw.githubusercontent.com/alexeygrigorev/datasets/master/housing.csv hang on MacOS Ventura M1?,machine-learning-zoomcamp,482
How can I resolve the IPv6 issue causing wget to hang on MacOS Ventura M1?,machine-learning-zoomcamp,482
Where can I find the network settings to configure IPv6 on MacOS Ventura M1?,machine-learning-zoomcamp,482
What should I set the IPv6 configuration to in order to resolve the wget issue on MacOS Ventura M1?,machine-learning-zoomcamp,482
How do I apply the manual IPv6 configuration on MacOS Ventura M1?,machine-learning-zoomcamp,482
What if I'm using MacOS and need to download a file using WGET?,machine-learning-zoomcamp,483
Is there an alternative to WGET on MacOS?,machine-learning-zoomcamp,483
How can I use CURL to download a file on MacOS?,machine-learning-zoomcamp,483
What does the '-o' flag do in CURL?,machine-learning-zoomcamp,483
Where can I find more information about using CURL?,machine-learning-zoomcamp,483
How do I limit the number of decimal places in my output?,machine-learning-zoomcamp,484
Can you explain the use of the round() function for this?,machine-learning-zoomcamp,484
How can I use f-strings to control decimal places?,machine-learning-zoomcamp,484
Is there a way to round values in a pandas Series?,machine-learning-zoomcamp,484
Where can I find more information on rounding in pandas?,machine-learning-zoomcamp,484
How do I access the live sessions for Week 2?,machine-learning-zoomcamp,485
Where can I find the calendar for weekly meetings?,machine-learning-zoomcamp,485
What is the link to the Week 2 homework?,machine-learning-zoomcamp,485
How do I submit my Week 2 homework?,machine-learning-zoomcamp,485
Where can I find the GitHub repository for the theory?,machine-learning-zoomcamp,485
Why am I getting a LinAlgError: Singular matrix in section 2?,machine-learning-zoomcamp,487
When will the Regularization video explain this error?,machine-learning-zoomcamp,487
Is it normal to have a Singular Matrix error?,machine-learning-zoomcamp,487
How can I fix this error if I've already taken the inverse of X twice?,machine-learning-zoomcamp,487
How can I avoid this error in the future?,machine-learning-zoomcamp,487
What is the California housing dataset?,machine-learning-zoomcamp,488
Where can I find a detailed description of the California housing dataset?,machine-learning-zoomcamp,488
How can I access the California housing dataset?,machine-learning-zoomcamp,488
What are the features of the California housing dataset?,machine-learning-zoomcamp,488
What is the target variable in the California housing dataset?,machine-learning-zoomcamp,488
Why am I getting NaNs after applying .mean() in my code?,machine-learning-zoomcamp,489
How can I handle NaNs when calculating RMSE using for loops?,machine-learning-zoomcamp,489
What step did I miss when preprocessing my data for the validation and test sets?,machine-learning-zoomcamp,489
Why is applying fillna(0) to all datasets important for calculating RMSE?,machine-learning-zoomcamp,489
How can I trace back the source of NaNs in my data?,machine-learning-zoomcamp,489
Why should we transform the target variable to a logarithmic distribution?,machine-learning-zoomcamp,490
Is this transformation necessary for all machine learning projects?,machine-learning-zoomcamp,490
How can we determine if our target variable is highly skewed?,machine-learning-zoomcamp,490
What is the easiest way to evaluate the skewness of our target variable?,machine-learning-zoomcamp,490
How does understanding skewness help in applying it to our dataset's distribution?,machine-learning-zoomcamp,490
How can I read the housing dataset directly into a pandas dataframe from GitHub?,machine-learning-zoomcamp,491
What is the technique to load the dataset directly from the GitHub link?,machine-learning-zoomcamp,491
How do I import the housing dataset from the provided GitHub link into a pandas dataframe?,machine-learning-zoomcamp,491
What is the code to read the housing dataset directly from the GitHub link into a pandas dataframe?,machine-learning-zoomcamp,491
How can I load the housing dataset directly into a pandas dataframe from the GitHub link provided in the course materials?,machine-learning-zoomcamp,491
How do I load a dataset directly into Kaggle Notebooks?,machine-learning-zoomcamp,492
What is the command to load the dataset using wget?,machine-learning-zoomcamp,492
Is it necessary to include '!' before wget?,machine-learning-zoomcamp,492
How do I read the loaded dataset using pandas?,machine-learning-zoomcamp,492
What is the filename of the dataset after loading?,machine-learning-zoomcamp,492
How can I filter a dataset using its values?,machine-learning-zoomcamp,493
What are the operators used for filtering in pandas?,machine-learning-zoomcamp,493
How can I filter a dataset using 'isin' method?,machine-learning-zoomcamp,493
What is the alternative method to filter a dataset using its values?,machine-learning-zoomcamp,493
How can I use 'OR' and 'AND' operators for filtering in pandas?,machine-learning-zoomcamp,493
How can I load the dataset from GitHub using the requests library?,machine-learning-zoomcamp,494
What is the URL of the dataset in the example?,machine-learning-zoomcamp,494
How do I check if the dataset was downloaded successfully?,machine-learning-zoomcamp,494
What is the purpose of using 'wb' mode when writing to the file?,machine-learning-zoomcamp,494
"Who is the author of this method, Tyler Simpson?",machine-learning-zoomcamp,494
Why is a null column still appearing after using .fillna()?,machine-learning-zoomcamp,495
How can I ensure .fillna() works as expected?,machine-learning-zoomcamp,495
What's causing the null column to persist?,machine-learning-zoomcamp,495
How do I create a deep copy of my dataframe to avoid null columns?,machine-learning-zoomcamp,495
How can I prevent null columns from appearing after applying .fillna()?,machine-learning-zoomcamp,495
Can I use Scikit-Learn's train_test_split in this week's exercises?,machine-learning-zoomcamp,496
Is it okay to use Scikit-Learn's train_test_split function now?,machine-learning-zoomcamp,496
When can I start using Scikit-Learn's train_test_split for splitting data?,machine-learning-zoomcamp,496
Is it acceptable to use Scikit-Learn's train_test_split in the current week's tasks?,machine-learning-zoomcamp,496
Can I begin using Scikit-Learn's train_test_split function in this week's assignments?,machine-learning-zoomcamp,496
Can I use LinearRegression from Scikit-Learn for this week's regression tasks?,machine-learning-zoomcamp,497
Is LinearRegression the only algorithm we'll cover for regression?,machine-learning-zoomcamp,497
When will we learn to use LinearRegression in this course?,machine-learning-zoomcamp,497
Will we only use Scikit-Learn for regression tasks?,machine-learning-zoomcamp,497
Is it necessary to understand LinearRegression for the upcoming week's assignment?,machine-learning-zoomcamp,497
"What are the Scikit-Learn functions for linear regression, both with and without regularization?",machine-learning-zoomcamp,498
What's the equivalent function in Scikit-Learn for linear regression without regularization?,machine-learning-zoomcamp,498
How do I perform linear regression with regularization using Scikit-Learn?,machine-learning-zoomcamp,498
What's the Scikit-Learn function for Ridge regression?,machine-learning-zoomcamp,498
Where can I find more information about Scikit-Learn's linear models?,machine-learning-zoomcamp,498
What is `r` in the context of our lesson's notebook?,machine-learning-zoomcamp,499
Is `r` used for the same purpose as `alpha` in sklearn's Ridge() function?,machine-learning-zoomcamp,499
How does `r` help prevent multicollinearity in our function?,machine-learning-zoomcamp,499
What happens to the regularization strength when I increase the value of `r`?,machine-learning-zoomcamp,499
How does the mathematical representation of `r` differ from that of `alpha` in sklearn's Ridge()?,machine-learning-zoomcamp,499
Why doesn't linear regression provide a perfect fit?,machine-learning-zoomcamp,500
Why is y_pred different from y after training?,machine-learning-zoomcamp,500
How does linear regression handle multiple features?,machine-learning-zoomcamp,500
What happens if we try to fit 100% of the data?,machine-learning-zoomcamp,500
How does linear regression perform on unseen data?,machine-learning-zoomcamp,500
Why does using a random seed of 42 cause all missing values to go to the training dataframe?,machine-learning-zoomcamp,501
What happens if I use a different seed value like 9?,machine-learning-zoomcamp,501
How does the seed value determine the split of data?,machine-learning-zoomcamp,501
Why is it important for learners to have the same behavior when using a seed value?,machine-learning-zoomcamp,501
What would happen if I don't use any seed value at all?,machine-learning-zoomcamp,501
How can I shuffle my entire dataset using pandas?,machine-learning-zoomcamp,502
What is the pandas function to shuffle a DataFrame?,machine-learning-zoomcamp,502
How do I reset the index after shuffling in pandas?,machine-learning-zoomcamp,502
How can I ensure the same shuffle every time I run my code?,machine-learning-zoomcamp,502
What is the syntax to shuffle a DataFrame with a specific seed in pandas?,machine-learning-zoomcamp,502
What if my homework answer doesn't match any options?,machine-learning-zoomcamp,503
Why might my answer differ from the provided options?,machine-learning-zoomcamp,503
How can I handle a discrepancy between my answer and the given options?,machine-learning-zoomcamp,503
What could cause my answer to be different from the provided options?,machine-learning-zoomcamp,503
What should I do if my answer doesn't match any of the given options?,machine-learning-zoomcamp,503
"What does 'For computing the mean, use the training only' mean in homework 2, question 3?",machine-learning-zoomcamp,504
Should I use only the training data set for calculating the mean in question 3 of HW02?,machine-learning-zoomcamp,504
How can I calculate the mean using only the training data set in Python?,machine-learning-zoomcamp,504
Is it acceptable to use validation or test data set for computing the mean in question 3 of HW02?,machine-learning-zoomcamp,504
What is another way to describe the mean of a column in the training data set?,machine-learning-zoomcamp,504
When should we transform the target variable to a logarithmic distribution?,machine-learning-zoomcamp,505
What is the appropriate transformation for a target variable with a long tail distribution?,machine-learning-zoomcamp,505
How do we handle target variables with a wide range?,machine-learning-zoomcamp,505
Is there a specific method for transforming target variables with a long tail distribution?,machine-learning-zoomcamp,505
What happens if our target variable has negative values when using np.log1p()?,machine-learning-zoomcamp,505
What does the 'ValueError: shapes not aligned' error mean in the context of machine learning for regression?,machine-learning-zoomcamp,506
When does the error 'operands could not be broadcast together with shapes' occur?,machine-learning-zoomcamp,506
How can we resolve the 'shapes not aligned' error in Python?,machine-learning-zoomcamp,506
What is the difference between using the dot() method and the * operator for array operations?,machine-learning-zoomcamp,506
In which scenarios can broadcasting occur and when does it fail?,machine-learning-zoomcamp,506
How do I create a deep copy of a dataframe in Python?,machine-learning-zoomcamp,507
What is the difference between a deep copy and a view of a dataframe?,machine-learning-zoomcamp,507
How can I prevent changes to a dataframe from affecting its copy?,machine-learning-zoomcamp,507
What is the syntax to create a deep copy of a dataframe in Python?,machine-learning-zoomcamp,507
How can I ensure that changes made to a dataframe's copy do not reflect back to the original?,machine-learning-zoomcamp,507
What does 'long tail' mean in the context of a distribution?,machine-learning-zoomcamp,508
"How does the 'long tail' affect the mean, median, and mode of a distribution?",machine-learning-zoomcamp,508
What changes in the area under the curve when a distribution has a 'long tail'?,machine-learning-zoomcamp,508
How does the 'long tail' impact the range of a distribution?,machine-learning-zoomcamp,508
What happens to the probability distribution when a distribution has a 'long tail'?,machine-learning-zoomcamp,508
What does standard deviation measure?,machine-learning-zoomcamp,509
How does standard deviation relate to the mean?,machine-learning-zoomcamp,509
What does a low standard deviation indicate?,machine-learning-zoomcamp,509
What does a high standard deviation indicate?,machine-learning-zoomcamp,509
How is standard deviation calculated?,machine-learning-zoomcamp,509
When should I use regularization techniques in machine learning?,machine-learning-zoomcamp,510
Is regularization always necessary for preventing overfitting?,machine-learning-zoomcamp,510
In what scenarios does regularization become crucial?,machine-learning-zoomcamp,510
How does the size and quality of data affect the need for regularization?,machine-learning-zoomcamp,510
"When training complex models, is regularization always required?",machine-learning-zoomcamp,510
How can I speed up data processing in the regression section?,machine-learning-zoomcamp,511
What functions can I define for faster execution?,machine-learning-zoomcamp,511
How can I prepare all dataframes and y_vectors at once?,machine-learning-zoomcamp,511
Can I reuse existing functions like rmse() and train_linear_regression()?,machine-learning-zoomcamp,511
How can I apply fillna() before splitting the initial dataframe?,machine-learning-zoomcamp,511
How do I calculate standard deviation using pandas?,machine-learning-zoomcamp,512
Can I find standard deviation directly on a pandas Series?,machine-learning-zoomcamp,512
How to use pandas to analyze a list of data for standard deviation?,machine-learning-zoomcamp,512
What's the method to find standard deviation in a pandas Series?,machine-learning-zoomcamp,512
How can I calculate standard deviation using a pandas Series from a list?,machine-learning-zoomcamp,512
What's the difference between Numpy and Pandas in calculating standard deviation?,machine-learning-zoomcamp,513
Why does Pandas use a different equation for standard deviation compared to Numpy?,machine-learning-zoomcamp,513
How can I make Numpy's standard deviation calculation similar to Pandas' default?,machine-learning-zoomcamp,513
What does the 'ddof' parameter do in Numpy's std function?,machine-learning-zoomcamp,513
How can I change the degree of freedom in Numpy's standard deviation calculation?,machine-learning-zoomcamp,513
How do I calculate standard deviation using Pandas?,machine-learning-zoomcamp,514
Can you explain the Pandas function for standard deviation?,machine-learning-zoomcamp,514
How can I find the standard deviation of a single column in Pandas?,machine-learning-zoomcamp,514
Is there a way to get standard deviation of multiple columns at once in Pandas?,machine-learning-zoomcamp,514
What's the syntax to calculate standard deviation using Pandas built-in function?,machine-learning-zoomcamp,514
How do I combine train and validation datasets?,machine-learning-zoomcamp,515
What functions can I use to merge two dataframes?,machine-learning-zoomcamp,515
How can I concatenate two numpy arrays?,machine-learning-zoomcamp,515
What is the code to combine train and validation datasets using pandas and numpy?,machine-learning-zoomcamp,515
How does George Chizhmak suggest combining train and validation datasets?,machine-learning-zoomcamp,515
What is RMSE in regression?,machine-learning-zoomcamp,516
How does RMSE measure model performance?,machine-learning-zoomcamp,516
