question,course,document
Why does the command 'aws ecr get-login --no-include-email' fail with 'aws: error: argument operation: Invalid choice...'?,machine-learning-zoomcamp,721
How can I resolve the issue with the 'aws ecr get-login --no-include-email' command?,machine-learning-zoomcamp,721
What does the error 'aws: error: argument operation: Invalid choice...' mean in the context of the 'aws ecr get-login --no-include-email' command?,machine-learning-zoomcamp,721
What is the correct way to use the 'aws ecr get-login --no-include-email' command to avoid the 'Invalid choice...' error?,machine-learning-zoomcamp,721
Where can I find more information to troubleshoot the 'aws ecr get-login --no-include-email' command error?,machine-learning-zoomcamp,721
What are the steps to create the necessary IAM policy for Week 9: Serverless?,machine-learning-zoomcamp,722
What specific AWS service should I select for the JSON policy?,machine-learning-zoomcamp,722
What actions should be included in the JSON policy for ECR?,machine-learning-zoomcamp,722
How do I review and create the policy after filling in the JSON?,machine-learning-zoomcamp,722
What is the JSON policy that needs to be copied and pasted for ECR actions?,machine-learning-zoomcamp,722
How can I resolve 'Temporary failure in name resolution' error in Docker?,machine-learning-zoomcamp,723
What are the steps to add custom DNS servers to Docker?,machine-learning-zoomcamp,723
How do I restart Docker after adding custom DNS servers?,machine-learning-zoomcamp,723
Who is Ibai Irastorza?,machine-learning-zoomcamp,723
What is the file path to edit for Docker's daemon.json?,machine-learning-zoomcamp,723
Why isn't my Keras model loading with a *.h5 file?,machine-learning-zoomcamp,724
What's causing the 'weight_decay is not a valid argument' error?,machine-learning-zoomcamp,724
How can I resolve the 'kwargs should be empty' issue for `optimizer_experimental.Optimizer`?,machine-learning-zoomcamp,724
What does 'compile = False' do in the `load_model` function?,machine-learning-zoomcamp,724
How can I load my model without encountering the 'weight_decay' error?,machine-learning-zoomcamp,724
How can I test AWS Lambda with Docker locally?,machine-learning-zoomcamp,725
What ports should I use for 'docker run'?,machine-learning-zoomcamp,725
How do I start an endpoint locally for testing?,machine-learning-zoomcamp,725
What is the format for posting an event using curl?,machine-learning-zoomcamp,725
How can I resolve a 'Runtime.MarshalError' when testing locally?,machine-learning-zoomcamp,725
Why am I getting 'No module named 'tensorflow'' error when running python test.py?,machine-learning-zoomcamp,726
How can I resolve the 'Unable to import module 'lambda_function' issue?,machine-learning-zoomcamp,726
What's causing the 'No module named 'tensorflow'' error in my serverless deep learning setup?,machine-learning-zoomcamp,726
How do I fix the 'No module named 'tensorflow'' error when running my test.py script?,machine-learning-zoomcamp,726
What should I change in my import statements to avoid the 'No module named 'tensorflow'' error?,machine-learning-zoomcamp,726
How can I use Docker in Google Colab?,machine-learning-zoomcamp,727
How do I resolve Lambda API Gateway errors like 'Authorization header requires...' and 'Missing Authentication Token'?,machine-learning-zoomcamp,727
Why can't I install tflite_runtime using pip from GitHub wheel links?,machine-learning-zoomcamp,727
How can I work around the issue of not being able to install tflite_runtime from GitHub wheel links in Docker?,machine-learning-zoomcamp,727
What is the first step to begin Week 10?,machine-learning-zoomcamp,728
How can I access the materials for this week?,machine-learning-zoomcamp,728
What topics will be covered in Week 10?,machine-learning-zoomcamp,728
What are the prerequisites for this week's section?,machine-learning-zoomcamp,728
How can I get started with Kubernetes and TensorFlow Serving?,machine-learning-zoomcamp,728
How to install TensorFlow on Ubuntu WSL2?,machine-learning-zoomcamp,729
What are the benefits of installing TensorFlow with CUDA support on my local machine?,machine-learning-zoomcamp,729
How can I install CUDA on WSL2?,machine-learning-zoomcamp,729
How do I install TensorFlow using pip?,machine-learning-zoomcamp,729
How can I get PyTorch installed and working on my machine?,machine-learning-zoomcamp,729
Why am I getting 'Allocator ran out of memory' errors when running TensorFlow on my machine?,machine-learning-zoomcamp,730
How can I allocate GPU memory dynamically to prevent these errors?,machine-learning-zoomcamp,730
What is the purpose of the `allow_growth` option in TensorFlow's GPU configuration?,machine-learning-zoomcamp,730
How can I set up a TensorFlow session with dynamic GPU memory allocation?,machine-learning-zoomcamp,730
Did others also experience these memory errors only during specific epochs?,machine-learning-zoomcamp,730
What should I do if I encounter a TypeError when running gateway.py in the virtual environment?,machine-learning-zoomcamp,731
How can I resolve the issue if my protobuf version is too new?,machine-learning-zoomcamp,731
What are some workarounds if I can't immediately regenerate my protos?,machine-learning-zoomcamp,731
How can I downgrade the protobuf package?,machine-learning-zoomcamp,731
What is the recommended protobuf version to avoid this issue?,machine-learning-zoomcamp,731
Why am I getting the error 'Cannot connect to the Docker daemon at unix:///var/run/docker.sock. Is the docker daemon running?' when trying to run a docker command?,machine-learning-zoomcamp,732
How can I fix the issue where Docker Desktop is not connecting to my WSL Linux distro?,machine-learning-zoomcamp,732
Where can I find the Docker Desktop settings to enable WSL Integration?,machine-learning-zoomcamp,732
What does enabling 'additional distros' under WSL Integration do?,machine-learning-zoomcamp,732
Is it necessary to have a different WSL distro for the additional distro option?,machine-learning-zoomcamp,732
Why isn't my HPA instance running properly?,machine-learning-zoomcamp,733
How can I fix the 'unknown' targets issue in my HPA?,machine-learning-zoomcamp,733
What should I do if the latest Metrics Server doesn't resolve my HPA issue?,machine-learning-zoomcamp,733
How can I enable insecure TLS for my kubelet?,machine-learning-zoomcamp,733
What command should I use to check my HPA after making changes?,machine-learning-zoomcamp,733
Why isn't my HPA instance running properly?,machine-learning-zoomcamp,734
How can I fix the 'unknown' targets issue?,machine-learning-zoomcamp,734
What's the easier solution to resolve HPA instance issues?,machine-learning-zoomcamp,734
What command should I run to fix the HPA instance problem?,machine-learning-zoomcamp,734
How can I apply a metrics server deployment file with the - --kubelet-insecure-tls option?,machine-learning-zoomcamp,734
Why am I getting an 'Access is denied' error when trying to install packages using pip on Windows?,machine-learning-zoomcamp,735
How can I resolve the 'OSError: [WinError 5] Access is denied' issue when installing libraries in Windows?,machine-learning-zoomcamp,735
What does the error 'Could not install packages due to an OSError: [WinError 5] Access is denied' mean and how can I fix it?,machine-learning-zoomcamp,735
What are the steps to install libraries like grpcio and tensorflow-serving-api on a Windows machine without encountering the 'Access is denied' error?,machine-learning-zoomcamp,735
How can I use the `--user` option in pip to install packages and avoid the 'Access is denied' error on Windows?,machine-learning-zoomcamp,735
What is causing the TypeError: Descriptors cannot not be created directly error?,machine-learning-zoomcamp,736
How can I resolve this error without downgrading protobuf?,machine-learning-zoomcamp,736
What are the possible workarounds for this issue?,machine-learning-zoomcamp,736
What is the recommended version of protoc to regenerate my code?,machine-learning-zoomcamp,736
How can I set PROTOCOL_BUFFERS_PYTHON_IMPLEMENTATION to use pure-Python parsing?,machine-learning-zoomcamp,736
How to install kubectl on Windows?,machine-learning-zoomcamp,737
What are the command lines to download kubectl using curl on Windows?,machine-learning-zoomcamp,737
How to add a folder path to the PATH environment variable on Windows?,machine-learning-zoomcamp,737
Can Kind be installed on Windows using the same method as kubectl?,machine-learning-zoomcamp,737
What are the specific steps to follow the tutorial for installing kubectl on Windows using the terminal in VSCode (powershell)?,machine-learning-zoomcamp,737
How do I install kind using choco?,machine-learning-zoomcamp,738
What is the first step to launch a powershell terminal with admin privileges?,machine-learning-zoomcamp,738
How do I set the execution policy for powershell?,machine-learning-zoomcamp,738
What is the syntax to install choco in powershell?,machine-learning-zoomcamp,738
How do I enable TLS 1.2 in powershell for choco installation?,machine-learning-zoomcamp,738
How can I install Kind if I'm having trouble with Windows Powershell and Choco Library?,machine-learning-zoomcamp,739
What is the first step to install Kind via Go?,machine-learning-zoomcamp,739
What command should I use to confirm my Go installation?,machine-learning-zoomcamp,739
How do I install Kind using Go?,machine-learning-zoomcamp,739
What command can I use to confirm the Kind installation?,machine-learning-zoomcamp,739
What should I do if kubectl is not working and I'm getting a connection refused error?,machine-learning-zoomcamp,740
How can I fix the issue where kubectl can't connect to the server at localhost:8080?,machine-learning-zoomcamp,740
What are the steps to resolve the problem of kubectl not being able to reach the server at the specified host or port?,machine-learning-zoomcamp,740
What should I do if kubectl is unable to connect to the Kubernetes service at localhost:8080?,machine-learning-zoomcamp,740
How can I troubleshoot the issue of kubectl failing to connect to the server at the given host and port?,machine-learning-zoomcamp,740
Why am I running out of storage on my 30-GB AWS instance?,machine-learning-zoomcamp,741
How can I remove unused Docker images to free up space?,machine-learning-zoomcamp,741
What command should I use to delete Docker images?,machine-learning-zoomcamp,741
Why doesn't deleting Docker images free up storage space?,machine-learning-zoomcamp,741
What additional command is needed after removing Docker images to free up space?,machine-learning-zoomcamp,741
What are the specific values for CPU and memory in the yaml file for HW10 Q6?,machine-learning-zoomcamp,742
Why are CPU and memory values not arbitrary for this homework?,machine-learning-zoomcamp,742
What is the defined correct value for the port in the form for HW10 Q6?,machine-learning-zoomcamp,742
How do I specify the correct values for CPU and memory in the yaml file for this question?,machine-learning-zoomcamp,742
What is the significance of the correct value for CPU and memory in the context of this homework?,machine-learning-zoomcamp,742
Why do CPU values in Kubernetes deployment.yaml look like '100m' and '500m'?,machine-learning-zoomcamp,743
What does 'm' stand for in these CPU values?,machine-learning-zoomcamp,743
How does '100m' translate to CPU cores?,machine-learning-zoomcamp,743
What does '500m' mean in terms of CPU cores?,machine-learning-zoomcamp,743
Why are CPU resources specified in milliCPUs in Kubernetes?,machine-learning-zoomcamp,743
Why can't Kind load my Docker image?,machine-learning-zoomcamp,744
How do I specify the cluster name when loading a Docker image with Kind?,machine-learning-zoomcamp,744
What's the correct command to load a Docker image into a specific Kind cluster?,machine-learning-zoomcamp,744
Why am I getting an 'ERROR: no nodes found for cluster' message?,machine-learning-zoomcamp,744
How can I resolve the 'no nodes found for cluster' error when using Kind?,machine-learning-zoomcamp,744
Why is 'kind' not recognized as a command in Windows?,machine-learning-zoomcamp,745
How do I rename the kind executable to 'kind.exe'?,machine-learning-zoomcamp,745
Where should I place the 'kind.exe' file?,machine-learning-zoomcamp,745
How do I add 'kind.exe' to my PATH in Windows?,machine-learning-zoomcamp,745
What is the default name of the kind executable for Windows?,machine-learning-zoomcamp,745
How do I run kind on Linux with Rootless Docker or Rootless Podman?,machine-learning-zoomcamp,746
What changes are needed on my Linux system to use kind with Rootless Docker or Rootless Podman?,machine-learning-zoomcamp,746
Where can I find more information about using kind in a rootless environment?,machine-learning-zoomcamp,746
Is there a specific guide for using kind with Rootless Podman on Linux?,machine-learning-zoomcamp,746
What are the key steps to set up kind with Rootless Docker on my Linux system?,machine-learning-zoomcamp,746
How do I deploy the Kubernetes Dashboard?,machine-learning-zoomcamp,747
How can I access the Kubernetes Dashboard?,machine-learning-zoomcamp,747
What are the steps to set up the Kubernetes Dashboard?,machine-learning-zoomcamp,747
How can I use the Kubernetes Dashboard to manage my cluster?,machine-learning-zoomcamp,747
What is the default URL to access the Kubernetes Dashboard?,machine-learning-zoomcamp,747
What is the correct AWS CLI version to use with eksctl?,machine-learning-zoomcamp,748
How can I check my current AWS CLI version?,machine-learning-zoomcamp,748
What are the migration instructions for AWS CLI v2?,machine-learning-zoomcamp,748
What are the system requirements for using eksctl with AWS?,machine-learning-zoomcamp,748
How can I update my AWS CLI to the latest version?,machine-learning-zoomcamp,748
What causes the TypeError: __init__() got an unexpected keyword argument 'unbound_message' when importing Flask?,machine-learning-zoomcamp,749
How can I resolve this error when running a Flask service in a Docker container?,machine-learning-zoomcamp,749
What is the relationship between the versions of Flask and Werkzeug causing this issue?,machine-learning-zoomcamp,749
How can I pin the version of Flask to resolve this error?,machine-learning-zoomcamp,749
What is the specific command to pin the version of Flask using pipenv?,machine-learning-zoomcamp,749
What is the correct command to get a login password for AWS ECR?,machine-learning-zoomcamp,750
How do I use the login password with Docker?,machine-learning-zoomcamp,750
What are the required fields to replace in the login command?,machine-learning-zoomcamp,750
Can I use the default region for AWS ECR login?,machine-learning-zoomcamp,750
How do I get the AWS account ID for the login command?,machine-learning-zoomcamp,750
Why am I getting an error when trying to download tensorflow/serving:2.7.0 on my Apple M1 Mac?,machine-learning-zoomcamp,751
What's the issue with running the docker code on an M1 Mac?,machine-learning-zoomcamp,751
How can I resolve the 'CHECK failed: file != nullptr' error?,machine-learning-zoomcamp,751
What's the solution to the 'qemu: uncaught target signal 6 (Aborted)' error?,machine-learning-zoomcamp,751
What's the alternative to using tensorflow/serving:2.7.0 on an M1 Mac?,machine-learning-zoomcamp,751
Why am I getting an 'Illegal instruction' error when running tensorflow/serving on Mac M2 Apple Silicon?,machine-learning-zoomcamp,752
What's the reason the tensorflow/serving image isn't maintained anymore?,machine-learning-zoomcamp,752
How can I resolve the 'Illegal instruction' error on Mac M2 Apple Silicon?,machine-learning-zoomcamp,752
What are the alternative steps to run tensorflow/serving on Mac M2 Apple Silicon?,machine-learning-zoomcamp,752
Can I use docker-compose to run bitnami/tensorflow-serving on Mac M2 Apple Silicon?,machine-learning-zoomcamp,752
Why isn't my HPA showing CPU metrics?,machine-learning-zoomcamp,753
What should I do if my HPA shows 'Unknown' for CPU metrics?,machine-learning-zoomcamp,753
How can I resolve the 'FailedGetResourceMetric' error for CPU utilization in my HPA?,machine-learning-zoomcamp,753
What steps should I follow to fix the issue of not being able to fetch CPU metrics from the resource metrics API?,machine-learning-zoomcamp,753
What is the solution to make my HPA report CPU metrics correctly?,machine-learning-zoomcamp,753
What's causing the error when running the quick installation script for KServe?,machine-learning-zoomcamp,754
How can I check my kubectl version?,machine-learning-zoomcamp,754
Why is Istio failing to update resources?,machine-learning-zoomcamp,754
What should I do if I'm using kubectl > 1.25.0?,machine-learning-zoomcamp,754
How do I edit the versions of Istio and Knative in the quick_install.bash file?,machine-learning-zoomcamp,754
What is the problem title for the midterm project?,machine-learning-zoomcamp,755
Can you describe the problem for the capstone project?,machine-learning-zoomcamp,755
What is the solution description for the midterm project?,machine-learning-zoomcamp,755
Who added the capstone project description?,machine-learning-zoomcamp,755
Is there a solution description for the capstone project?,machine-learning-zoomcamp,755
What are the project deadlines for the midterm and capstone?,machine-learning-zoomcamp,756
Where can I find the project deadlines?,machine-learning-zoomcamp,756
How do I access the project deadlines for my cohort?,machine-learning-zoomcamp,756
What is the source of the project deadlines?,machine-learning-zoomcamp,756
Are the project deadlines the same for all cohorts?,machine-learning-zoomcamp,756
Are midterm projects solo or can they be done in groups?,machine-learning-zoomcamp,757
Is it possible to have a partner for the capstone project?,machine-learning-zoomcamp,757
Can I work with others on my midterm project?,machine-learning-zoomcamp,757
Are group projects allowed for the capstone?,machine-learning-zoomcamp,757
Is it mandatory to work alone on the midterm and capstone projects?,machine-learning-zoomcamp,757
What modules should my midterm project cover?,machine-learning-zoomcamp,758
What topics should my capstone project include?,machine-learning-zoomcamp,758
Can I include topics beyond the covered modules in my project?,machine-learning-zoomcamp,758
What resources can I use to prepare for my project?,machine-learning-zoomcamp,758
How can I document topics not covered in class in my project?,machine-learning-zoomcamp,758
What are the crucial links for all projects in our course?,machine-learning-zoomcamp,759
Where can I find the Midterm Project Sample?,machine-learning-zoomcamp,759
What is the link to submit the MidTerm Project?,machine-learning-zoomcamp,759
What are some reliable datasets sources for our projects?,machine-learning-zoomcamp,759
What are the specific steps and deliverables expected for the Midterm Project?,machine-learning-zoomcamp,759
How do I access previous cohorts' project instructions?,machine-learning-zoomcamp,760
Where can I find the g-sheet with links to submitted projects for peer review?,machine-learning-zoomcamp,760
What is the evaluation deadline for project reviews?,machine-learning-zoomcamp,760
How are our hashed emails used in the peer review process?,machine-learning-zoomcamp,760
Can you provide a link to the projects page for further reference?,machine-learning-zoomcamp,760
How do I compute the hash for project review?,machine-learning-zoomcamp,761
Where can I find the hash computation guide for project review?,machine-learning-zoomcamp,761
What steps are involved in calculating the hash for project review?,machine-learning-zoomcamp,761
Is there a specific tool or software required to compute the hash for project review?,machine-learning-zoomcamp,761
How do I ensure the accuracy of the hash computation for project review?,machine-learning-zoomcamp,761
How many posts are required for the learning in public midterm project?,machine-learning-zoomcamp,762
"Is it 14 posts, one for each day?",machine-learning-zoomcamp,762
"Or should we follow the regular seven posts per module, each worth 2 points?",machine-learning-zoomcamp,762
Is there a specific value assigned to each post?,machine-learning-zoomcamp,762
How does the total value of 14! factor into the posting requirement?,machine-learning-zoomcamp,762
How can I handle a dataset that's too large to load into GitHub?,machine-learning-zoomcamp,763
Is there a way to upload large files to a GitHub repository?,machine-learning-zoomcamp,763
What's a solution for dealing with datasets that don't fit in GitHub?,machine-learning-zoomcamp,763
How can I manage large datasets in a GitHub project?,machine-learning-zoomcamp,763
Is there a tool to help with uploading large files to GitHub for a project?,machine-learning-zoomcamp,763
What happens if I submit only two projects and miss the third?,machine-learning-zoomcamp,764
Do I still get the course certificate if I submit only two projects?,machine-learning-zoomcamp,764
Is it possible to get the course certificate with only two projects?,machine-learning-zoomcamp,764
What is the minimum number of projects required to get the course certificate?,machine-learning-zoomcamp,764
What if I fail to submit the third project?,machine-learning-zoomcamp,764
Can I skip the last project to avoid two peer reviews in the second capstone?,machine-learning-zoomcamp,765
Do I need to review peers if I haven't submitted a project?,machine-learning-zoomcamp,765
Is it confirmed that peer reviews are only required upon project submission?,machine-learning-zoomcamp,765
What happens if I miss a project submission?,machine-learning-zoomcamp,765
How many projects do I need to complete for the capstone?,machine-learning-zoomcamp,765
How many models should I train for the midterm?,machine-learning-zoomcamp,766
What does 'multiple models' mean in the midterm deliverables?,machine-learning-zoomcamp,766
Is there a specific number of models I should train?,machine-learning-zoomcamp,766
What if I can't train more than one model?,machine-learning-zoomcamp,766
How will my models be evaluated?,machine-learning-zoomcamp,766
How do I find the projects to review?,machine-learning-zoomcamp,767
What is the link to access all submitted projects?,machine-learning-zoomcamp,767
How do I calculate my reviewer hash?,machine-learning-zoomcamp,767
Where do I find my assigned peer projects in the spreadsheet?,machine-learning-zoomcamp,767
How do I search for my peer projects using the hashed email value?,machine-learning-zoomcamp,767
How is my project grade calculated?,machine-learning-zoomcamp,768
Is it based on the average of others' scores?,machine-learning-zoomcamp,768
Or is it based on my total score?,machine-learning-zoomcamp,768
What's the passing criteria for projects?,machine-learning-zoomcamp,768
How does the grading system ensure most students pass?,machine-learning-zoomcamp,768
Why is a train.py file required when I've already submitted a notebook.ipynb file?,machine-learning-zoomcamp,769
What's the purpose of including train.py in the midterm project submission?,machine-learning-zoomcamp,769
How will my peers use the train.py file for reviewing my project?,machine-learning-zoomcamp,769
Should the train.py file be included in the conda environment or pipenv?,machine-learning-zoomcamp,769
What's the benefit of having a train.py file for cross-checking on other systems?,machine-learning-zoomcamp,769
How do I load an image using the PIL library?,machine-learning-zoomcamp,770
How can I convert a PIL image to a numpy array?,machine-learning-zoomcamp,770
What is the import statement for the Image class in PIL?,machine-learning-zoomcamp,770
How do I install the PIL library?,machine-learning-zoomcamp,770
What is the function to convert an image to a numpy array?,machine-learning-zoomcamp,770
Is a train.py file necessary if I have a train.ipynb file in my project directory?,machine-learning-zoomcamp,771
Why is a train.py file preferred over a train.ipynb file for model training?,machine-learning-zoomcamp,771
Can I submit my project with only a train.ipynb file?,machine-learning-zoomcamp,771
What are the advantages of using a train.py file over a train.ipynb file for model training?,machine-learning-zoomcamp,771
Is it mandatory to have a train.py file in my project submission?,machine-learning-zoomcamp,771
Is there a way to create a form for users to input data for the model to process?,machine-learning-zoomcamp,772
Can you guide me on how to build a mobile app or interface for these forms?,machine-learning-zoomcamp,772
What kind of validations should I perform on the backend?,machine-learning-zoomcamp,772
Is Streamlit a suitable tool for creating these forms?,machine-learning-zoomcamp,772
Who is Alejandro Aponte and what is his role in this context?,machine-learning-zoomcamp,772
How do I get feature importance for an XGBoost model?,machine-learning-zoomcamp,773
Why am I getting an AttributeError when using model.feature_importances_?,machine-learning-zoomcamp,773
What should I use instead of model.feature_importances_ if I trained the model with xgb.train?,machine-learning-zoomcamp,773
How can I access feature importances if I used xgb.train to train my model?,machine-learning-zoomcamp,773
Who is Ekaterina Kutovaia?,machine-learning-zoomcamp,773
How do I resolve the 'Cannot allocate memory' error in AWS ECS?,machine-learning-zoomcamp,774
What does the '[Errno 12] Cannot allocate memory' error mean in AWS ECS?,machine-learning-zoomcamp,774
How can I increase the RAM and CPU for my task definition in AWS ECS?,machine-learning-zoomcamp,774
