question,course,document
When does the course start?,data-engineering-zoomcamp,0
What is the exact time the course begins?,data-engineering-zoomcamp,0
How can I subscribe to the course calendar?,data-engineering-zoomcamp,0
How do I register for the course before it starts?,data-engineering-zoomcamp,0
What is the link to register for the course?,data-engineering-zoomcamp,0
What are the prerequisites for this course?,data-engineering-zoomcamp,1
What should I know before starting this course?,data-engineering-zoomcamp,1
What are the required skills for this course?,data-engineering-zoomcamp,1
What is the recommended background for this course?,data-engineering-zoomcamp,1
What are the necessary foundations for this course?,data-engineering-zoomcamp,1
Can I still join the course after the start date?,data-engineering-zoomcamp,2
Will I be able to submit homework if I join late?,data-engineering-zoomcamp,2
Are there deadlines for final projects even if I join late?,data-engineering-zoomcamp,2
Can I still turn in homework if I miss the start date?,data-engineering-zoomcamp,2
What are the deadlines for final projects if I join after the course starts?,data-engineering-zoomcamp,2
When do I receive the confirmation email for the Data Engineering Bootcamp?,data-engineering-zoomcamp,3
Is the confirmation email necessary to start learning and submitting homework?,data-engineering-zoomcamp,3
Can I start learning and submitting homework without registering?,data-engineering-zoomcamp,3
Is the registration list checked against my submissions?,data-engineering-zoomcamp,3
What is the purpose of registration for the Data Engineering Bootcamp?,data-engineering-zoomcamp,3
What should I do to prepare for the course before it starts?,data-engineering-zoomcamp,4
What are the necessary dependencies and requirements for this course?,data-engineering-zoomcamp,4
Do I need to have a Google cloud account?,data-engineering-zoomcamp,4
Is Python 3 required for this course?,data-engineering-zoomcamp,4
What are the prerequisites and syllabus for this course?,data-engineering-zoomcamp,4
How many Zoom Camps are there in a year?,data-engineering-zoomcamp,5
How many live cohorts are there per Zoom Camp?,data-engineering-zoomcamp,5
What is the duration of the Data-Engineering Zoomcamp?,data-engineering-zoomcamp,5
"Can I take Zoom Camps at my own pace, outside of live cohorts?",data-engineering-zoomcamp,5
"If I'm not interested in the certificate, can I take any Zoom Camp at any time?",data-engineering-zoomcamp,5
What changes can we expect in the 2024 cohort compared to the previous one?,data-engineering-zoomcamp,6
Will the 2024 cohort use Mage AI instead of Prefect?,data-engineering-zoomcamp,6
Why was Prefect used in the 2023 cohort instead of Airflow?,data-engineering-zoomcamp,6
Are the terraform videos the same in the 2024 cohort as in previous ones?,data-engineering-zoomcamp,6
What are the key differences between the 2023 and 2024 cohorts?,data-engineering-zoomcamp,6
Can I access course materials after it ends?,data-engineering-zoomcamp,7
Will I still have access to homework after the course finishes?,data-engineering-zoomcamp,7
Can I continue preparing for the next cohort after the course ends?,data-engineering-zoomcamp,7
Can I start working on my final capstone project after the course finishes?,data-engineering-zoomcamp,7
Will I be able to follow the course at my own pace after it ends?,data-engineering-zoomcamp,7
Can I get support if I take the course in the self-paced mode?,data-engineering-zoomcamp,8
Is there a Slack channel for support in self-paced mode?,data-engineering-zoomcamp,8
How can I effectively use the Slack channel for support?,data-engineering-zoomcamp,8
Is there a bot that can help me search for answers?,data-engineering-zoomcamp,8
Can I rely on the bot's answers 100%?,data-engineering-zoomcamp,8
What's the main YouTube playlist for this course?,data-engineering-zoomcamp,9
Where can I find the course's GitHub repository?,data-engineering-zoomcamp,9
Are there year-specific playlists for additional videos?,data-engineering-zoomcamp,9
How do I access the course's Slack channel?,data-engineering-zoomcamp,9
Can you provide the link to the main playlist?,data-engineering-zoomcamp,9
How many hours per week should I allocate for this course?,data-engineering-zoomcamp,10
What's the estimated time commitment for this course each week?,data-engineering-zoomcamp,10
"Given my background, how many hours per week should I expect to spend on this course?",data-engineering-zoomcamp,10
What's the range of hours I should dedicate to this course weekly?,data-engineering-zoomcamp,10
How can I calculate the expected weekly hours for this course based on my experience?,data-engineering-zoomcamp,10
Is the course certificate available for self-paced learners?,data-engineering-zoomcamp,11
Can I earn a certificate by completing the course independently?,data-engineering-zoomcamp,11
Is a certificate provided for those who finish the course at their own pace?,data-engineering-zoomcamp,11
Is there a certificate for self-paced course completion?,data-engineering-zoomcamp,11
Can I get a certificate without participating in a live cohort?,data-engineering-zoomcamp,11
Where can I find the link to join the Office Hour or workshop sessions?,data-engineering-zoomcamp,12
How do I access the Office Hour or workshop sessions?,data-engineering-zoomcamp,12
What platform is used for Office Hour or workshop sessions?,data-engineering-zoomcamp,12
Where can I find the link to the Office Hour or workshop sessions before they begin?,data-engineering-zoomcamp,12
How can I ask questions during the Office Hour or workshop sessions?,data-engineering-zoomcamp,12
Will Office Hours be recorded if I can't attend?,data-engineering-zoomcamp,13
Can I watch Office Hours later?,data-engineering-zoomcamp,13
Is there a recording available after the live session?,data-engineering-zoomcamp,13
When will the Office Hours recording be available?,data-engineering-zoomcamp,13
Can I rewatch Office Hours?,data-engineering-zoomcamp,13
What are the homework deadlines?,data-engineering-zoomcamp,14
Where can I find project deadlines?,data-engineering-zoomcamp,14
How do I know if a deadline has changed?,data-engineering-zoomcamp,14
Who announces deadline extensions?,data-engineering-zoomcamp,14
How can I check for updated deadlines?,data-engineering-zoomcamp,14
Is it possible to submit homework late?,data-engineering-zoomcamp,15
What happens if I submit homework after the due date but before the form closes?,data-engineering-zoomcamp,15
Can I still submit homework if the form is open past the due date?,data-engineering-zoomcamp,15
How can I confirm my homework submission after the due date?,data-engineering-zoomcamp,15
What is the consequence of submitting homework late?,data-engineering-zoomcamp,15
What is the homework URL in the homework link?,data-engineering-zoomcamp,16
Where can I find my homework URL?,data-engineering-zoomcamp,16
"How do I access my homework on GitHub, GitLab, or Bitbucket?",data-engineering-zoomcamp,16
What is the location of my homework repository?,data-engineering-zoomcamp,16
Where should I upload my homework code?,data-engineering-zoomcamp,16
How are homework points calculated?,data-engineering-zoomcamp,17
Where can I see my homework points?,data-engineering-zoomcamp,17
What is the leaderboard based on?,data-engineering-zoomcamp,17
How do I earn points for FAQs?,data-engineering-zoomcamp,17
How do I earn points for Learning in Public?,data-engineering-zoomcamp,17
How do I find my display name on the leaderboard?,data-engineering-zoomcamp,18
Can I change my display name?,data-engineering-zoomcamp,18
Why am I not appearing on the leaderboard?,data-engineering-zoomcamp,18
How do I access the leaderboard?,data-engineering-zoomcamp,18
Is my leaderboard position based on my display name?,data-engineering-zoomcamp,18
What is the recommended Python version to use in 2024?,data-engineering-zoomcamp,19
Is it okay to use Python 3.10 or 3.11?,data-engineering-zoomcamp,19
Why is Python 3.9 still recommended?,data-engineering-zoomcamp,19
Are there any troubleshooting issues with Python 3.10 and 3.11?,data-engineering-zoomcamp,19
How do the recorded videos relate to the Python version?,data-engineering-zoomcamp,19
Should I use my local machine for the course environment?,data-engineering-zoomcamp,20
"What challenges might I face using a local machine, especially on Windows?",data-engineering-zoomcamp,20
Can I start with the Introduction to Docker on my local machine?,data-engineering-zoomcamp,20
What are the steps to set up a virtual machine for the course?,data-engineering-zoomcamp,20
Can I work on the course using GitHub Codespaces?,data-engineering-zoomcamp,20
Is GitHub Codespaces a viable alternative to using CLI/Git Bash for ingesting data and creating a Docker file?,data-engineering-zoomcamp,21
Can I use GitHub Codespaces for Linux computing resources with pre-installed tools like Docker and Docker Compose?,data-engineering-zoomcamp,21
Is Python also available in GitHub Codespaces?,data-engineering-zoomcamp,21
Can I open any GitHub repository in a GitHub Codespace?,data-engineering-zoomcamp,21
What are the benefits of using GitHub Codespaces over traditional CLI/Git Bash methods?,data-engineering-zoomcamp,21
Do we have to use GitHub codespaces for the course?,data-engineering-zoomcamp,22
Can I use my existing PostgreSQL & Docker installation?,data-engineering-zoomcamp,22
Are these the only platforms suggested for the course?,data-engineering-zoomcamp,22
Can I complete the course using just my laptop?,data-engineering-zoomcamp,22
What are the benefits of using GitHub codespaces or GCP VM?,data-engineering-zoomcamp,22
Do I need both GitHub Codespaces and GCP for this course?,data-engineering-zoomcamp,23
Is it necessary to use both GitHub Codespaces and GCP?,data-engineering-zoomcamp,23
Can I use only one of GitHub Codespaces or GCP for the course?,data-engineering-zoomcamp,23
Is it mandatory to use both GitHub Codespaces and GCP for the end project?,data-engineering-zoomcamp,23
Can I set up a local environment instead of using GitHub Codespaces and GCP?,data-engineering-zoomcamp,23
How do I connect to a GCP VM using VSCode on a Windows machine?,data-engineering-zoomcamp,24
What are the shortcut keys to open the Run command window?,data-engineering-zoomcamp,24
How do I open the Registry Editor?,data-engineering-zoomcamp,24
What are the steps to change the 'Autorun' registry value in 'HKEY_CURRENT_USERSoftwareMicrosoftCommand Processor'?,data-engineering-zoomcamp,24
Where is the 'known_hosts' file located in Windows?,data-engineering-zoomcamp,24
Why are we using GCP instead of other cloud providers like AWS?,data-engineering-zoomcamp,25
Can I use other cloud platforms like AWS for this course?,data-engineering-zoomcamp,25
Why is GCP preferred for uniformity?,data-engineering-zoomcamp,25
What are the benefits of using GCP for this course?,data-engineering-zoomcamp,25
Is a credit card required to sign up for a free GCP account?,data-engineering-zoomcamp,25
Should I pay for cloud services?,data-engineering-zoomcamp,26
Is it necessary to pay for cloud services?,data-engineering-zoomcamp,26
Are cloud services free on GCP?,data-engineering-zoomcamp,26
Can I use GCP's cloud services without paying?,data-engineering-zoomcamp,26
How can I avoid paying for cloud services on GCP?,data-engineering-zoomcamp,26
Is it possible to complete the course without using cloud providers like GCP?,data-engineering-zoomcamp,27
What can I do locally instead of using BigQuery?,data-engineering-zoomcamp,27
Are there local alternatives for all the materials in the course?,data-engineering-zoomcamp,27
Can I complete the entire course using only local resources?,data-engineering-zoomcamp,27
What parts of the course won't have local alternatives?,data-engineering-zoomcamp,27
Can I use AWS in this course?,data-engineering-zoomcamp,28
What adaptations should I make if I use AWS?,data-engineering-zoomcamp,28
Will I be able to get help with AWS-specific issues?,data-engineering-zoomcamp,28
Is there a minimum number of coursemates using AWS?,data-engineering-zoomcamp,28
Can I use a different tool instead of the one recommended?,data-engineering-zoomcamp,28
What other live Zoom calls are there besides Office Hours?,data-engineering-zoomcamp,29
When are the Capstone period calls?,data-engineering-zoomcamp,29
Will there be any other live Zoom sessions apart from Office Hours?,data-engineering-zoomcamp,29
What is the purpose of the Capstone period calls?,data-engineering-zoomcamp,29
How will I be notified about additional live Zoom calls?,data-engineering-zoomcamp,29
Are we using the NYC Trip data from January 2021 or 2022?,data-engineering-zoomcamp,30
Will the project change significantly from last year's?,data-engineering-zoomcamp,30
Where can I find the data for this year's project?,data-engineering-zoomcamp,30
Is the data for this year's project the same as last year's?,data-engineering-zoomcamp,30
What is the link to access the data?,data-engineering-zoomcamp,30
Where is the 2022 course material?,data-engineering-zoomcamp,31
Is the 2022 repo still accessible?,data-engineering-zoomcamp,31
What happened to the 2022 course files?,data-engineering-zoomcamp,31
How can I access the 2022 course content?,data-engineering-zoomcamp,31
Where did the 2022 course material go?,data-engineering-zoomcamp,31
Can I use Airflow for my final project?,data-engineering-zoomcamp,32
Are there any restrictions on the tools I can use for my project?,data-engineering-zoomcamp,32
Is there a specific tool I should use for my final project?,data-engineering-zoomcamp,32
Can I use a tool not mentioned in the course for my project?,data-engineering-zoomcamp,32
What are the acceptable tools for my final project?,data-engineering-zoomcamp,32
Can I use Airflow or Prefect instead of Mage in this course?,data-engineering-zoomcamp,33
Is it possible to use AWS or Snowflake instead of GCP products?,data-engineering-zoomcamp,33
Can I use Tableau instead of Metabase or Google data studio?,data-engineering-zoomcamp,33
Can I use my own tool of choice for the data stack?,data-engineering-zoomcamp,33
Will I receive support if I choose a different stack for my capstone project?,data-engineering-zoomcamp,33
How can we contribute to the course?,data-engineering-zoomcamp,34
What are ways to support the course?,data-engineering-zoomcamp,34
How can we help improve the course?,data-engineering-zoomcamp,34
What actions can we take to contribute to the course?,data-engineering-zoomcamp,34
How can we show our support for the course?,data-engineering-zoomcamp,34
Is the course Linux-friendly?,data-engineering-zoomcamp,35
Can I use Windows for this course?,data-engineering-zoomcamp,35
Is macOS compatible with the course?,data-engineering-zoomcamp,35
Are there any OS-specific requirements for the course?,data-engineering-zoomcamp,35
Can students use different operating systems for this course?,data-engineering-zoomcamp,35
How do I run *.sh shell scripts on Windows?,data-engineering-zoomcamp,36
Is Git Bash or MINGW64 sufficient for running *.sh scripts?,data-engineering-zoomcamp,36
Why is WSL recommended for this course?,data-engineering-zoomcamp,36
What are the Windows alternatives for running shell scripts in later modules?,data-engineering-zoomcamp,36
How can I ensure I can continue with the course on Windows without using WSL?,data-engineering-zoomcamp,36
What books or additional resources would you recommend for this course?,data-engineering-zoomcamp,37
Are there any online resources you suggest for further learning?,data-engineering-zoomcamp,37
Can you provide a list of recommended books for data engineering?,data-engineering-zoomcamp,37
What are some useful online resources for data engineering students?,data-engineering-zoomcamp,37
Is there a document that lists recommended resources for data engineering?,data-engineering-zoomcamp,37
What are Project Attempt #1 and Project Attempt #2?,data-engineering-zoomcamp,38
How many project attempts do I have?,data-engineering-zoomcamp,38
What happens if I miss the first project deadline?,data-engineering-zoomcamp,38
Can I resubmit my project if I fail the first attempt?,data-engineering-zoomcamp,38
What is the deadline for the second project attempt?,data-engineering-zoomcamp,38
How do I start troubleshooting issues in this course?,data-engineering-zoomcamp,39
What should I do if I encounter an error with a specific line of code?,data-engineering-zoomcamp,39
How can I effectively search for solutions to my problems online?,data-engineering-zoomcamp,39
What steps should I take before asking a question in the course's Slack channel?,data-engineering-zoomcamp,39
How can I format my code properly when asking for help?,data-engineering-zoomcamp,39
What am I coding on and what OS am I using?,data-engineering-zoomcamp,40
What specific command did I run or video did I follow?,data-engineering-zoomcamp,40
What error message did I receive and does it have a line number?,data-engineering-zoomcamp,40
What have I already tried that didn't work?,data-engineering-zoomcamp,40
Have I checked my code for typos?,data-engineering-zoomcamp,40
How do I use Git/GitHub for this course?,data-engineering-zoomcamp,41
How do I clone the course repo to my local machine?,data-engineering-zoomcamp,41
How do I create my own repositories on GitHub?,data-engineering-zoomcamp,41
What files should I ignore in my Git repository?,data-engineering-zoomcamp,41
How do I use .gitignore to ignore files?,data-engineering-zoomcamp,41
How do I fix the 'Error: Makefile:2: *** missing separator. Stop.' error in VS Code when using tabs with spaces?,data-engineering-zoomcamp,42
What should I do to resolve the 'missing separator' error in VS Code's Makefile?,data-engineering-zoomcamp,42
How can I convert tabs to spaces in VS Code to avoid the 'Error: Makefile:2: *** missing separator. Stop.' error?,data-engineering-zoomcamp,42
What is the correct way to handle tabs in VS Code's Makefile to avoid errors?,data-engineering-zoomcamp,42
How do I ensure my Makefile in VS Code uses the correct tab format to avoid errors?,data-engineering-zoomcamp,42
How do I open an HTML file using a Windows browser from Linux running on WSL?,data-engineering-zoomcamp,43
Can I customize which browser is used to open HTML files in WSL?,data-engineering-zoomcamp,43
What command should I use to open an HTML file with a specific browser in WSL?,data-engineering-zoomcamp,43
How does the BROWSER environment variable work in WSL?,data-engineering-zoomcamp,43
Is it possible to open HTML files from WSL using the host's browser without installing additional software?,data-engineering-zoomcamp,43
How do I set up Chrome Remote Desktop on a Linux VM instance on Compute Engine?,data-engineering-zoomcamp,44
Why am I getting a 403: Forbidden error when trying to download 2021 Yellow Taxi Trip Records from TLC's website?,data-engineering-zoomcamp,44
What is the correct link to download the 2021 Yellow Taxi Trip Records data?,data-engineering-zoomcamp,44
How do I unzip the downloaded 'gz' file?,data-engineering-zoomcamp,44
Is there a backup source for the TLC data if the main website is inaccessible?,data-engineering-zoomcamp,44
How should I handle taxi data files that are available as *.csv.gz?,data-engineering-zoomcamp,45
What's the issue with storing the data file as 'output.csv.gz'?,data-engineering-zoomcamp,45
"How can I replace 'csv_name = ""output.csv""' with the actual file name from the URL?",data-engineering-zoomcamp,45
What's the URL for the yellow taxi data file?,data-engineering-zoomcamp,45
How can I parse the file name from the URL to use as 'csv_name'?,data-engineering-zoomcamp,45
What are the data dictionaries for the NY Taxi data?,data-engineering-zoomcamp,46
Where can I find the data dictionary for Yellow Trips?,data-engineering-zoomcamp,46
Is there a data dictionary for Green Trips as well?,data-engineering-zoomcamp,46
What specific details does the data dictionary for Yellow Trips cover?,data-engineering-zoomcamp,46
How can I access the data dictionary for Green Trips?,data-engineering-zoomcamp,46
How do I unzip a parquet file in the command line?,data-engineering-zoomcamp,47
What is the command to convert a parquet file to a csv file using pandas?,data-engineering-zoomcamp,47
How can I download a parquet file and save it with a specific name?,data-engineering-zoomcamp,47
What is the function to read a parquet file in pandas?,data-engineering-zoomcamp,47
How do I write a DataFrame to a csv file without indexing?,data-engineering-zoomcamp,47
Why is 'wget' not recognized on my system?,data-engineering-zoomcamp,48
How do I install 'wget' on Ubuntu?,data-engineering-zoomcamp,48
What's the easiest way to install 'wget' on MacOS?,data-engineering-zoomcamp,48
How can I install 'wget' on Windows using Chocolatey?,data-engineering-zoomcamp,48
What's an alternative to 'wget' for downloading files in Python?,data-engineering-zoomcamp,48
Why am I getting a certificate error with wget on MacOS?,data-engineering-zoomcamp,49
How can I verify a website's certificate using wget?,data-engineering-zoomcamp,49
What is the correct syntax to bypass certificate verification with wget?,data-engineering-zoomcamp,49
How can I use Python's wget library to download a file?,data-engineering-zoomcamp,49
Why is it necessary to add '!' before wget in a Jupyter Notebook or CLI?,data-engineering-zoomcamp,49
How do I use the backslash as an escape character in Git Bash for Windows?,data-engineering-zoomcamp,50
What command should I type to make the backslash an escape character in Git Bash on Windows?,data-engineering-zoomcamp,50
How can I set the backslash as the escape character in Git Bash for Windows?,data-engineering-zoomcamp,50
What is the command to use the backslash as an escape character in Git Bash on Windows?,data-engineering-zoomcamp,50
How do I configure Git Bash to use the backslash as an escape character on Windows?,data-engineering-zoomcamp,50
How do I store secrets for GitHub Codespaces?,data-engineering-zoomcamp,51
Where can I find instructions on managing account-specific secrets for GitHub Codespaces?,data-engineering-zoomcamp,51
How can I make secrets available in GitHub Codespaces?,data-engineering-zoomcamp,51
What is the GitHub documentation for managing secrets in Codespaces?,data-engineering-zoomcamp,51
How do I ensure my secrets are accessible in GitHub Codespaces?,data-engineering-zoomcamp,51
Is the Docker daemon running?,data-engineering-zoomcamp,52
How do I start the Docker daemon?,data-engineering-zoomcamp,52
How to update WSL in PowerShell?,data-engineering-zoomcamp,52
What is the command to update WSL in PowerShell?,data-engineering-zoomcamp,52
What should I do if I can't connect to the Docker daemon?,data-engineering-zoomcamp,52
How do I enable Hyper-V on Windows 10/11 Pro to use Docker?,data-engineering-zoomcamp,53
Can I use Docker on Windows 10/11 Home without Hyper-V?,data-engineering-zoomcamp,53
How do I install WSL2 to use Docker on Windows 10/11 Home?,data-engineering-zoomcamp,53
What should I do if WslRegisterDistribution fails with error 0x800701bc?,data-engineering-zoomcamp,53
How can I update the WSL2 Linux Kernel?,data-engineering-zoomcamp,53
What does 'docker pull' do and how does it fetch Docker images?,data-engineering-zoomcamp,54
How do I handle private Docker repositories when using 'docker pull'?,data-engineering-zoomcamp,54
Why am I getting a 'permission denied' error when creating a PostgreSQL Docker container on macOS M1 with a mounted volume?,data-engineering-zoomcamp,54
How can I resolve the 'chown' error when trying to create a Docker container on macOS M1?,data-engineering-zoomcamp,54
What are the steps to switch from Rancher Desktop to Docker Desktop to resolve compatibility issues on macOS M1?,data-engineering-zoomcamp,54
How do I delete a local folder that's mounted to a Docker volume?,data-engineering-zoomcamp,55
Why can't I delete a folder created by Docker on my local machine?,data-engineering-zoomcamp,55
How can I remove a folder with read and write protection owned by user 999?,data-engineering-zoomcamp,55
What command can I use to forcefully delete a Docker-created folder?,data-engineering-zoomcamp,55
How do I change the location of a folder that's causing access errors in Obsidian?,data-engineering-zoomcamp,55
How do I update Docker for Windows to the latest version?,data-engineering-zoomcamp,56
Why is Docker stuck on starting?,data-engineering-zoomcamp,56
How can I switch between Windows and Linux containers?,data-engineering-zoomcamp,56
How do I enable Hyper-V on Windows 10/11 to run Docker?,data-engineering-zoomcamp,56
What are the steps to use WSL2 as the backend for Docker on Windows 10/11?,data-engineering-zoomcamp,56
Should I use Windows file system or Linux distribution in WSL for Docker commands?,data-engineering-zoomcamp,57
Is WSL2 required for Docker on Windows Home Edition?,data-engineering-zoomcamp,57
How to set up WSL2 for Docker on Windows Home Edition?,data-engineering-zoomcamp,57
What if Docker is still not working after setting up WSL2?,data-engineering-zoomcamp,57
What are the troubleshooting steps for Docker issues on Windows Home Edition?,data-engineering-zoomcamp,57
What's the best way to store my code in Docker for optimal file system performance on Windows 10/11 Home?,data-engineering-zoomcamp,58
Is it recommended to use the default Linux distro's file system for Docker on Windows Home/11 Home?,data-engineering-zoomcamp,58
Where can I find more information on Docker best practices for file system performance?,data-engineering-zoomcamp,58
